{
  "$schema": "https://json-schema.org/draft/2020-12/schema",
  "$id": "https://scout.local/schema/target-host-u3-gencase-execution-policy-v8.json",
  "title": "R8 liquid U3 C1M GenCase execution policy v8",
  "type": "object",
  "additionalProperties": false,
  "required": [
    "schema_version",
    "document_type",
    "policy_id",
    "host_id",
    "development_only",
    "formal",
    "physical_primary_eligible",
    "execution_scope",
    "revision_reason",
    "allowed_gate_commands",
    "frozen_attempt",
    "rejected_predecessor",
    "rejected_v7_attempt",
    "seed_provenance",
    "trusted_artifacts",
    "trusted_tools",
    "lifecycle_harness",
    "immutable_transport",
    "outer_supervisor",
    "identity_contract",
    "isolation",
    "resources",
    "fixed_guest_command",
    "output_contract",
    "profile_lifecycle",
    "required_harmless_probes",
    "invariants",
    "status",
    "next_allowed_stage"
  ],
  "properties": {
    "schema_version": {"const": "smpcc-r8-liquid-target-u3-gencase-execution-policy-v8"},
    "document_type": {"const": "SMPCC_R8_LIQUID_TARGET_U3_GENCASE_EXECUTION_POLICY"},
    "policy_id": {"const": "LIQUID_ZRJ_MSI_U2404_U3_GENCASE_EXECUTION_V8"},
    "host_id": {"const": "LIQUID_ZRJ_MSI_U2404"},
    "development_only": {"const": true},
    "formal": {"const": false},
    "physical_primary_eligible": {"const": false},
    "execution_scope": {"const": "one_exact_c1m_zero_motion_gencase_v8_attempt_after_frozen_v7_dual_motion_audit_failure_and_v11_probe"},
    "revision_reason": {"type": "string", "minLength": 1},
    "allowed_gate_commands": {"const": ["self-check", "internal-run"]},
    "frozen_attempt": {"type": "object"},
    "rejected_predecessor": {"type": "object"},
    "rejected_v7_attempt": {"type": "object"},
    "seed_provenance": {"type": "object"},
    "trusted_artifacts": {"type": "object"},
    "trusted_tools": {"type": "object"},
    "lifecycle_harness": {"type": "object"},
    "immutable_transport": {"type": "object"},
    "outer_supervisor": {"type": "object"},
    "identity_contract": {"type": "object"},
    "isolation": {"type": "object"},
    "resources": {"type": "object"},
    "fixed_guest_command": {"type": "object"},
    "output_contract": {"type": "object"},
    "profile_lifecycle": {"type": "object"},
    "required_harmless_probes": {"type": "object"},
    "invariants": {"type": "object"},
    "status": {"const": "ADMITTED_SINGLE_C1M_ZERO_MOTION_GENCASE_RUNTIME_V8_AFTER_FROZEN_V7_DUAL_MOTION_AUDIT_FAILURE_AND_V11_ZERO_DENIAL_PROBE"},
    "next_allowed_stage": {"const": "EXECUTE_ONCE_THEN_VALIDATE_C1M_IDENTITY_OR_FREEZE_FAILURE"}
  }
}
