{
  "schema_version": "smpcc-r8-liquid-target-u3-gencase-execution-policy-v8",
  "document_type": "SMPCC_R8_LIQUID_TARGET_U3_GENCASE_EXECUTION_POLICY",
  "policy_id": "LIQUID_ZRJ_MSI_U2404_U3_GENCASE_EXECUTION_V8",
  "host_id": "LIQUID_ZRJ_MSI_U2404",
  "development_only": true,
  "formal": false,
  "physical_primary_eligible": false,
  "execution_scope": "one_exact_c1m_zero_motion_gencase_v8_attempt_after_frozen_v7_dual_motion_audit_failure_and_v11_probe",
  "revision_reason": "Fresh v8 replaces the permanently consumed v7 identity. V7 ran GenCase successfully and proved fixed=0, moving=2669, floating=0 and fluid=6409 with zero AppArmor denials, but its guest auditor incorrectly required one motion element across the whole generated XML. The fixed upstream format preserves the source casedef/motion and writes a normalized execution/motion, so v8 changes only the output audit to require exactly those two semantically identical ref=0, begin mov=1/start=0, mvnull id=1 copies. Geometry, particle spacing, mk ordering, water depth, domain, Shifting=1, DtAllParticles=1, isolation, resources, tools, mounts, network/device absence and cleanup authority remain frozen.",
  "allowed_gate_commands": ["self-check", "internal-run"],
  "frozen_attempt": {
    "case_id": "u3_c1m_gencase_v8_20260808T153753Z",
    "attempt_root": "/home/zrj/scout_liquid_lab/cases/u3_c1m_gencase_v8_20260808T153753Z.partial",
    "output_root": "/home/zrj/scout_liquid_lab/cases/u3_c1m_gencase_v8_20260808T153753Z.partial/output",
    "start_receipt": "/home/zrj/scout_liquid_lab/audits/u3_c1m_gencase_v8_20260808T153753Z.start.json",
    "execution_receipt": "/home/zrj/scout_liquid_lab/audits/u3_c1m_gencase_v8_20260808T153753Z.execution.json",
    "lifecycle_receipt": "/home/zrj/scout_liquid_lab/audits/u3_c1m_gencase_v8_20260808T153753Z.lifecycle.json",
    "lifecycle_failure_receipt": "/home/zrj/scout_liquid_lab/audits/u3_c1m_gencase_v8_20260808T153753Z.lifecycle_incomplete.json",
    "console_log": "/home/zrj/scout_liquid_lab/audits/u3_c1m_gencase_v8_20260808T153753Z.console.log",
    "snapshot_root": "/run/r8-liquid-u3_c1m_gencase_v8_20260808T153753Z.snapshot",
    "bootstrap_profile": "r8-liquid-u3-c1m-gencase-bootstrap-v8-20260808t153753z",
    "runtime_profile": "r8-liquid-u3-c1m-gencase-runtime-v8-20260808t153753z"
  },
  "rejected_predecessor": {
    "identity": "u3_c1_gencase_v5_20260808T070530Z",
    "permanent_status": "ATTEMPT_ABORTED_NO_RETRY_SAME_IDENTITY",
    "reason": "GenCase completed with 9078 particles, three-file handling reached XML audit and the AppArmor window had zero denials; v5 rejected only the source-proven empty execution/motion node, exported no case, and closed labels, profiles, sysctls and sudo lifecycle",
    "policy": "config/target_hosts/liquid_zrj_msi_u2404_u3_gencase_execution_policy_v5.json",
    "start_receipt": "/home/zrj/scout_liquid_lab/audits/u3_c1_gencase_v5_20260808T070530Z.start.json",
    "start_receipt_sha256": "9b26b2334eefc6549d315176be69823fc40e4de87495dc07daeefd38e8d0bac3",
    "execution_receipt": "/home/zrj/scout_liquid_lab/audits/u3_c1_gencase_v5_20260808T070530Z.execution.json",
    "execution_receipt_sha256": "49b23780ff1d6085c7ae1c5073ca1ee71fcf806657da6138d3dbfd39d893ba83",
    "lifecycle_receipt": "/home/zrj/scout_liquid_lab/audits/u3_c1_gencase_v5_20260808T070530Z.lifecycle_incomplete.json",
    "lifecycle_receipt_sha256": "7bf446a6aacf58b6459f40c6d3214f3c9317d0c76a3fbb67af66a66d539bd374"
  },
  "rejected_v7_attempt": {
    "identity": "u3_c1m_gencase_v7_20260808T151500Z",
    "permanent_status": "ATTEMPT_ABORTED_NO_RETRY_SAME_IDENTITY",
    "failure_class": "SOURCE_PROVEN_DUAL_MOTION_COPY_AUDITOR_FALSE_NEGATIVE",
    "reason": "GenCase completed with the exact C1M particle summary, but the v7 guest auditor rejected the generated XML because it required all_motion == [execution_motion] and did not allow the source-proven casedef/motion copy retained alongside normalized execution/motion",
    "start_receipt": "/home/zrj/scout_liquid_lab/audits/u3_c1m_gencase_v7_20260808T151500Z.start.json",
    "start_receipt_sha256": "85bb282afd9201c9e1a185060d7389c7a8a5ba69767ed62d7b5cbb5d739439d2",
    "execution_receipt": "/home/zrj/scout_liquid_lab/audits/u3_c1m_gencase_v7_20260808T151500Z.execution.json",
    "execution_receipt_sha256": "d9a90ae5a2464c2e3c5b24675af07feac1155237f7a1105c331f757821e0633c",
    "lifecycle_receipt": "/home/zrj/scout_liquid_lab/audits/u3_c1m_gencase_v7_20260808T151500Z.lifecycle_incomplete.json",
    "lifecycle_receipt_sha256": "00f2924a6213315f8a96b2ee0a13003d7df48b2009a3e011d829fa5efa5f918d",
    "gencase_completed": true,
    "particle_summary": {"fixed": 0, "moving": 2669, "floating": 0, "fluid": 6409, "total": 9078},
    "case_exported": false,
    "cleanup_complete": true
  },
  "seed_provenance": {
    "seed_id": "u3_c1m_gencase_seed_v3_20260808T150802Z",
    "seed_root": "/home/zrj/scout_liquid_lab/dependency/runtime/u3_c1m_gencase_seed_v3_20260808T150802Z.partial",
    "input_root": "/home/zrj/scout_liquid_lab/dependency/runtime/u3_c1m_gencase_seed_v3_20260808T150802Z.partial/input",
    "receipt": "/home/zrj/scout_liquid_lab/audits/u3_c1m_gencase_seed_v3_20260808T150802Z.json",
    "receipt_sha256": "79f43b54594843e0107aa78ad01db34937fa97f0a34a16d96e74ac9cd90095ed",
    "receipt_status": "PASS_NONEXECUTABLE_GENCASE_SEED_V3_MATERIALIZATION",
    "files": {
      "GenCase_linux64": {"sha256": "a1b6414e0f716669363d1a80a05e133085c04995e15716e3c1f0406e0d023226", "size_bytes": 5809384, "seed_mode": "0400", "snapshot_mode": "0444"},
      "DsphConfig.xml": {"sha256": "0644c9a6a6687678950fc8966e352b4bbd3de9d3cb787db9e507c2eb7ccaddcd", "size_bytes": 293, "seed_mode": "0400", "snapshot_mode": "0444"},
      "C1M_moving_zero_Def.xml": {"sha256": "1711b10f366770cb1b6aa2af799c093596c9d606c914c4a68b9bcdb9fa844b52", "size_bytes": 6070, "seed_mode": "0400", "snapshot_mode": "0444", "corrections": ["drawcylinder mask=2", "MinFluidStop=1", "PartsOutMax absent", "casedef motion ref=0/mvnull", "Shifting=1", "DtAllParticles=1"]}
    }
  },
  "trusted_artifacts": {
    "gate": {"path": "scripts/r8_liquid_target_u3_gencase_gate_v8.py", "sha256": "6bad21b0fbd4e5c3f2534c9cb2c9f3b28455a5cea1f4ac4021c6019cdd261448", "size_bytes": 42944},
    "helper": {"path": "scripts/r8_liquid_u3_gencase_bootstrap_helper_v8.py", "sha256": "a1e5ca0bf2608314baaf77a6851b5e3e17a3416f7af5a488cd28380b30317832", "size_bytes": 26710},
    "supervisor": {"path": "scripts/r8_liquid_target_u3_gencase_supervisor_v8.py", "sha256": "5d28bafe3104066f178be50edb28bdd98e12d22c2f7ac97413003d91ac44605d", "size_bytes": 81238},
    "profile": {"path": "config/apparmor_drafts/r8-liquid-u3-gencase-v8.profile", "sha256": "43c4e0e315344c1752d8a595fa448502c9c57a8232e1298732ff4ce87ab7afdd", "size_bytes": 3852},
    "schema": {"path": "schema/target_host_u3_gencase_execution_policy_v8.json", "sha256": "25f46d10d6daa5cd1e87339f2c9a8faa8412571558d309d0b366d40fe2d4536e", "size_bytes": 2658}
  },
  "trusted_tools": {
    "aa_exec": {"path": "/usr/bin/aa-exec", "sha256": "f28cbce3c8664cab5154492fdbc55ecb937a3e7ce1a9478c881a5f5965d7ce3e"},
    "aa_status": {"path": "/usr/sbin/aa-status", "sha256": "af9f579ad039f0e669bfb15735c55efd17896f838d684e7f9be15b09fa1e2dd4"},
    "apparmor_parser": {"path": "/usr/sbin/apparmor_parser", "sha256": "6bc852b37807961c14976be9a227ae96bd817f73b5189cb0e0ff5eca4448c01c"},
    "bwrap": {"path": "/usr/bin/bwrap", "sha256": "52231e1caf55bcbc667b269f49c63599a6f7db4767ae6a039580d0ff853db712"},
    "python": {"path": "/usr/bin/python3.12", "sha256": "1643dacd9feaedc58f3cc581e4d22577dfe25c09b10282936186ccf0f2e61118"},
    "setpriv": {"path": "/usr/bin/setpriv", "sha256": "96b083b79c32fd2f0c29657e88e20c7495839349fc64ad5d0503f32d26bf8733"},
    "sha256sum": {"path": "/usr/bin/sha256sum", "sha256": "9992e1f1feb6f0f396bc8d6691ebc1adbfc269fd628bce84eda1d4ba5c3995c7"},
    "sudo": {"path": "/usr/bin/sudo", "sha256": "136f2e48b0295b9fc595b8259cf2411ac43f27ddbfe02b956649ddaa2e92b9fa"},
    "timeout": {"path": "/usr/bin/timeout", "sha256": "4fccd5b0192653a2446b745d5385ea547b78e466150e07ade9e2caff2b7f4e08"}
  },
  "lifecycle_harness": {
    "path": "scripts/r8_liquid_target_u3_stdio_apparmor_transport_probe_supervisor_v11.py",
    "sha256": "72b7f1bf287b4fe750b46dccdb7a1eae9379230c7bdc30dbc6a6cb33a403ef5b",
    "size_bytes": 159126,
    "reuse_scope": ["bounded_command", "pidfd_all_task_label_cleanup", "profile_state", "journal_cursor_audit", "sysctl_snapshot", "sudo_timestamp_cleanup"],
    "v11_identity_or_runtime_reexecuted": false
  },
  "immutable_transport": {
    "root_supervisor_snapshot": "root_owned_0555_directory_with_ten_exact_0444_regular_single_link_files",
    "source_read_rule": "one O_NOFOLLOW descriptor supplies both hash and copied bytes",
    "input_delivery": "fixed_no_declared_lengths_stdin_frame_to_hash_pinned_in_memory_helper",
    "input_frame": {"helper_magic": "R8C1HELPERV8", "input_magic": "R8C1INPUTV8", "segment_order": ["GenCase_linux64", "DsphConfig.xml", "C1M_moving_zero_Def.xml"], "segment_lengths": [5809384, 293, 6070], "strict_eof_required": true},
    "guest_helper_load": "python3.12 -I -B -S fixed loader compiles exact helper bytes from memory",
    "guest_input_postcondition": "stdin consumed to exact EOF then fd0 replaced by guest-internal EOF pipe before GenCase",
    "output_delivery": "success_only_single_bounded_stdout_binary_frame_then_uid1000_O_EXCL",
    "output_frame": {"magic": "R8C1GENCASEV8", "version": 1, "header_format": ">16sIIQQQQ", "canonical_metadata_max_bytes": 65536, "bi4_max_bytes": 16777216, "xml_max_bytes": 524288, "out_max_bytes": 1048576, "console_max_bytes": 1048576, "total_max_bytes": 19464248, "trailing_bytes": "forbidden"},
    "host_fd_delivery_to_guest": "only root admission nonce reaches outer UID1000 gate; bwrap guest receives no host fd other than stdio pipes",
    "host_writable_mount_or_bind": "none"
  },
  "outer_supervisor": {